[
  {
    "name": "Plain",
    "moveCost": {
      "Infantry": "1",
      "Armored": "1",
      "Cavalry": "1",
      "Flying": "1"
    },
    "avoidBonus": "0",
    "defBonus": "0",
    "special": ""
  },
  {
    "name": "Forest",
    "moveCost": {
      "Infantry": "2",
      "Armored": "2",
      "Cavalry": "3",
      "Flying": "1"
    },
    "avoidBonus": "20",
    "defBonus": "1",
    "special": ""
  },
  {
    "name": "Mountain",
    "moveCost": {
      "Infantry": "3",
      "Armored": "--",
      "Cavalry": "--",
      "Flying": "1"
    },
    "avoidBonus": "30",
    "defBonus": "2",
    "special": "Infantry & Flying only"
  },
  {
    "name": "Fort",
    "moveCost": {
      "Infantry": "1",
      "Armored": "1",
      "Cavalry": "1",
      "Flying": "1"
    },
    "avoidBonus": "20",
    "defBonus": "2",
    "special": "Heals 10% HP/turn"
  },
  {
    "name": "Throne",
    "moveCost": {
      "Infantry": "1",
      "Armored": "1",
      "Cavalry": "1",
      "Flying": "1"
    },
    "avoidBonus": "15",
    "defBonus": "3",
    "special": "Heals 10% HP/turn. Boss/Seize tile"
  },
  {
    "name": "Wall",
    "moveCost": {
      "Infantry": "--",
      "Armored": "--",
      "Cavalry": "--",
      "Flying": "--"
    },
    "avoidBonus": "--",
    "defBonus": "--",
    "special": "Impassable"
  },
  {
    "name": "Water",
    "moveCost": {
      "Infantry": "--",
      "Armored": "--",
      "Cavalry": "--",
      "Flying": "1"
    },
    "avoidBonus": "10",
    "defBonus": "0",
    "special": "Flying only (standard)"
  },
  {
    "name": "Bridge",
    "moveCost": {
      "Infantry": "1",
      "Armored": "1",
      "Cavalry": "1",
      "Flying": "1"
    },
    "avoidBonus": "0",
    "defBonus": "0",
    "special": "Crosses water"
  },
  {
    "name": "Sand",
    "moveCost": {
      "Infantry": "2",
      "Armored": "3",
      "Cavalry": "3",
      "Flying": "1"
    },
    "avoidBonus": "5",
    "defBonus": "0",
    "special": "Slows armored/cavalry significantly"
  },
  {
    "name": "Village",
    "moveCost": {
      "Infantry": "1",
      "Armored": "1",
      "Cavalry": "1",
      "Flying": "1"
    },
    "avoidBonus": "10",
    "defBonus": "1",
    "special": "End a unit's action here to visit: gold and supplies."
  },
  {
    "name": "Ice",
    "moveCost": {
      "Infantry": "1",
      "Armored": "1",
      "Cavalry": "1",
      "Flying": "1"
    },
    "avoidBonus": "-10",
    "defBonus": "0",
    "special": "Slide: non-fliers slide until off the Ice; the first tile is free, then each costs MOV until it runs out. A unit shoved, smitten or driven onto Ice by another unit slides on too, at no cost"
  },
  {
    "name": "Lava Crack",
    "moveCost": {
      "Infantry": "1",
      "Armored": "2",
      "Cavalry": "1",
      "Flying": "1"
    },
    "avoidBonus": "0",
    "defBonus": "0",
    "special": "Burns 5 HP at the end of its side's phase (never below 1 HP). Flying units are immune"
  },
  {
    "name": "Floor",
    "moveCost": {
      "Infantry": "1",
      "Armored": "1",
      "Cavalry": "1",
      "Flying": "1"
    },
    "avoidBonus": "0",
    "defBonus": "0",
    "special": "Indoor tile"
  },
  {
    "name": "Pillar",
    "moveCost": {
      "Infantry": "2",
      "Armored": "2",
      "Cavalry": "2",
      "Flying": "2"
    },
    "avoidBonus": "20",
    "defBonus": "1",
    "special": "Indoor cover. Slows all unit types."
  },
  {
    "name": "Ballista",
    "moveCost": {
      "Infantry": "1",
      "Armored": "1",
      "Cavalry": "1",
      "Flying": "1"
    },
    "avoidBonus": "10",
    "defBonus": "1",
    "special": "Fires at enemies in range (3 tiles in Act II, 4 in Act III, 5 after). Stand on tile to capture."
  },
  {
    "name": "Swamp",
    "moveCost": {
      "Infantry": "3",
      "Armored": "--",
      "Cavalry": "--",
      "Flying": "1"
    },
    "avoidBonus": "-10",
    "defBonus": "0",
    "special": "Infantry and Flying only. Negative avoid."
  },
  {
    "name": "Bog",
    "moveCost": {
      "Infantry": "2",
      "Armored": "3",
      "Cavalry": "3",
      "Flying": "1"
    },
    "avoidBonus": "-5",
    "defBonus": "0",
    "special": "Universal access but slow. Negative avoid."
  },
  {
    "name": "Acidic Swamp",
    "moveCost": {
      "Infantry": "3",
      "Armored": "--",
      "Cavalry": "--",
      "Flying": "1"
    },
    "avoidBonus": "-10",
    "defBonus": "0",
    "special": "Infantry and Flying only.",
    "hazardStatus": "acid"
  },
  {
    "name": "Acidic Bog",
    "moveCost": {
      "Infantry": "2",
      "Armored": "3",
      "Cavalry": "3",
      "Flying": "1"
    },
    "avoidBonus": "-5",
    "defBonus": "0",
    "special": "Slow for all.",
    "hazardStatus": "acid"
  },
  {
    "name": "Abyss",
    "moveCost": {
      "Infantry": "--",
      "Armored": "--",
      "Cavalry": "--",
      "Flying": "1"
    },
    "avoidBonus": "0",
    "defBonus": "0",
    "special": "A drop into the dark. Flying only"
  }
]
